{
  "protocol_version": "a2a-trace-v0",
  "trace_id": "trace_research_to_write_run",
  "participants": [
    {
      "participant_id": "human.user",
      "kind": "human",
      "display_name": "User",
      "capabilities": []
    },
    {
      "participant_id": "agent.planner",
      "kind": "agent",
      "display_name": "Planner Agent",
      "capabilities": [
        "plan.research_to_write"
      ]
    },
    {
      "participant_id": "agent.researcher",
      "kind": "agent",
      "display_name": "Research Agent",
      "capabilities": [
        "research.web"
      ]
    },
    {
      "participant_id": "agent.writer",
      "kind": "agent",
      "display_name": "Writer Agent",
      "capabilities": [
        "write.summary"
      ]
    },
    {
      "participant_id": "tool.search",
      "kind": "tool",
      "display_name": "Search Tool",
      "capabilities": [
        "search.web"
      ]
    },
    {
      "participant_id": "tool.model",
      "kind": "tool",
      "display_name": "Model Service",
      "capabilities": [
        "model.chat_completion"
      ]
    }
  ],
  "messages": [
    {
      "envelope": {
        "message_id": "msg_user_request",
        "trace_id": "trace_research_to_write_run",
        "task_id": "task_research_to_write_run",
        "conversation_id": "conv_research_to_write_run",
        "sequence": 1,
        "timestamp": "2026-06-23T00:00:00Z",
        "sender": "human.user",
        "receiver": "agent.planner",
        "intent": "request",
        "correlation_id": "corr_user_task"
      },
      "content": {
        "summary": "Human asks Planner Agent to complete a Research-to-Write task.",
        "data": {
          "goal": "Explain A2A communication."
        }
      }
    },
    {
      "envelope": {
        "message_id": "msg_planner_delegate_research",
        "trace_id": "trace_research_to_write_run",
        "task_id": "task_research_to_write_run",
        "conversation_id": "conv_research_to_write_run",
        "sequence": 2,
        "timestamp": "2026-06-23T00:00:01Z",
        "sender": "agent.planner",
        "receiver": "agent.researcher",
        "intent": "delegate",
        "correlation_id": "corr_research",
        "reply_to": "msg_user_request"
      },
      "content": {
        "summary": "Planner Agent delegates research to Research Agent.",
        "data": {
          "goal": "Gather source material for: Explain A2A communication."
        }
      }
    },
    {
      "envelope": {
        "message_id": "msg_research_tool_call",
        "trace_id": "trace_research_to_write_run",
        "task_id": "task_research_to_write_run",
        "conversation_id": "conv_research_to_write_run",
        "sequence": 3,
        "timestamp": "2026-06-23T00:00:02Z",
        "sender": "agent.researcher",
        "receiver": "tool.search",
        "intent": "tool_call",
        "correlation_id": "corr_search",
        "reply_to": "msg_planner_delegate_research"
      },
      "content": {
        "summary": "Research Agent calls Search Tool for source material.",
        "data": {
          "tool_name": "search",
          "arguments": {
            "query": "Explain A2A communication."
          }
        }
      }
    },
    {
      "envelope": {
        "message_id": "msg_search_result",
        "trace_id": "trace_research_to_write_run",
        "task_id": "task_research_to_write_run",
        "conversation_id": "conv_research_to_write_run",
        "sequence": 4,
        "timestamp": "2026-06-23T00:00:03Z",
        "sender": "tool.search",
        "receiver": "agent.researcher",
        "intent": "tool_result",
        "correlation_id": "corr_search",
        "reply_to": "msg_research_tool_call"
      },
      "content": {
        "summary": "Search Tool returns raw fixture retrieval results.",
        "data": {
          "query": "Explain A2A communication.",
          "results": [
            {
              "rank": 1,
              "title": "A2A Communication Basics",
              "url": "https://example.com/a2a-communication-basics",
              "snippet": "A2A communication coordinates agents through structured messages, routing, intent, and traceable results."
            },
            {
              "rank": 2,
              "title": "Traceable Agent Collaboration",
              "url": "https://example.com/traceable-agent-collaboration",
              "snippet": "Inspectable traces help developers understand delegation, tool calls, and final responses."
            }
          ]
        }
      }
    },
    {
      "envelope": {
        "message_id": "msg_research_response",
        "trace_id": "trace_research_to_write_run",
        "task_id": "task_research_to_write_run",
        "conversation_id": "conv_research_to_write_run",
        "sequence": 5,
        "timestamp": "2026-06-23T00:00:04Z",
        "sender": "agent.researcher",
        "receiver": "agent.planner",
        "intent": "response",
        "correlation_id": "corr_research",
        "reply_to": "msg_planner_delegate_research"
      },
      "content": {
        "summary": "Research Agent interprets raw search results for the Planner.",
        "data": {
          "findings": [
            "A2A communication uses structured messages with routing and intent.",
            "Trace records make collaboration inspectable."
          ],
          "source_message_id": "msg_search_result"
        }
      }
    },
    {
      "envelope": {
        "message_id": "msg_planner_delegate_writer",
        "trace_id": "trace_research_to_write_run",
        "task_id": "task_research_to_write_run",
        "conversation_id": "conv_research_to_write_run",
        "sequence": 6,
        "timestamp": "2026-06-23T00:00:05Z",
        "sender": "agent.planner",
        "receiver": "agent.writer",
        "intent": "delegate",
        "correlation_id": "corr_write",
        "reply_to": "msg_research_response"
      },
      "content": {
        "summary": "Planner Agent delegates final writing to Writer Agent.",
        "data": {
          "goal": "Write the final response from the research findings."
        }
      }
    },
    {
      "envelope": {
        "message_id": "msg_writer_model_call",
        "trace_id": "trace_research_to_write_run",
        "task_id": "task_research_to_write_run",
        "conversation_id": "conv_research_to_write_run",
        "sequence": 7,
        "timestamp": "2026-06-23T00:00:06Z",
        "sender": "agent.writer",
        "receiver": "tool.model",
        "intent": "tool_call",
        "correlation_id": "corr_model_write",
        "reply_to": "msg_planner_delegate_writer"
      },
      "content": {
        "summary": "Writer Agent calls the model service to draft the final response.",
        "data": {
          "tool_name": "model",
          "provider": "mock",
          "model": "mock",
          "prompt_summary": "Write a concise final answer for the user's task. Task: Explain A2A communication. Research findings: - A2A communication uses structured messages with routi..."
        }
      }
    },
    {
      "envelope": {
        "message_id": "msg_writer_model_result",
        "trace_id": "trace_research_to_write_run",
        "task_id": "task_research_to_write_run",
        "conversation_id": "conv_research_to_write_run",
        "sequence": 8,
        "timestamp": "2026-06-23T00:00:07Z",
        "sender": "tool.model",
        "receiver": "agent.writer",
        "intent": "tool_result",
        "correlation_id": "corr_model_write",
        "reply_to": "msg_writer_model_call"
      },
      "content": {
        "summary": "Model Service returns a draft response to Writer Agent.",
        "data": {
          "provider": "mock",
          "model": "mock",
          "response_summary": "A2A communication coordinates agents through structured messages that carry routing, intent, content, correlation, and trace information."
        }
      }
    },
    {
      "envelope": {
        "message_id": "msg_writer_response",
        "trace_id": "trace_research_to_write_run",
        "task_id": "task_research_to_write_run",
        "conversation_id": "conv_research_to_write_run",
        "sequence": 9,
        "timestamp": "2026-06-23T00:00:08Z",
        "sender": "agent.writer",
        "receiver": "human.user",
        "intent": "response",
        "correlation_id": "corr_user_task",
        "reply_to": "msg_writer_model_result"
      },
      "content": {
        "summary": "Writer Agent returns the final response.",
        "data": {
          "answer": "A2A communication coordinates agents through structured messages that carry routing, intent, content, correlation, and trace information."
        }
      }
    }
  ],
  "outcome": {
    "status": "completed",
    "final_message_id": "msg_writer_response",
    "summary": "The Research-to-Write Scenario completed with a Writer Agent response."
  }
}